{
  "cases": [
    {
      "candidates": [
        {
          "allocation": {
            "block": 512,
            "grid": 64,
            "hard_gate": "no spill and no resource-cap regression",
            "unchanged_from_n0": true
          },
          "bytes_by_boundary": {
            "global_bytes_change_vs_n0": 0,
            "logical_request_bytes": 23134592,
            "physical_transactions": "UNKNOWN_NOT_NEEDED_FOR_STATIC_ADMISSION"
          },
          "correctness": {
            "semantic_boundaries": [
              "BF16_score",
              "BF16_raw_o",
              "independent_gated_RMS_post"
            ],
            "status": "PENDING"
          },
          "decision": "CONDITIONAL_CANDIDATE",
          "device_coverage": {
            "one_wave_grid_fraction": 0.3764705882352941,
            "sm_count": 170,
            "status": "GEOMETRIC_BOUND_NOT_UTILIZATION"
          },
          "measured_us": {
            "median": null,
            "status": "NOT_MEASURED",
            "unit": "us"
          },
          "padded_compute": {
            "dense_tensor_flop": 208142336,
            "status": "EXPLICIT_16x16_TILE_GRANULARITY"
          },
          "predicted_dag_us": {
            "lower": 0.0,
            "note": "decision window only; not a silicon performance bound",
            "status": "UNRANKED_NO_LATENCY_BENEFIT_ASSUMED",
            "unit": "us",
            "upper": 34.57899997889996
          },
          "schedule_id": "N1",
          "synchronization": {
            "candidate_extra_barriers": 0,
            "cross_kernel_edges": [
              "s01_to_s2",
              "s2_to_s3",
              "s3_to_post"
            ],
            "kernel_count": 4
          },
          "uncertainty": {
            "reason": "scheduled FLOP removal does not determine latency under issue/control/resource coupling",
            "status": "PRODUCTION_AB_REQUIRED"
          },
          "valid_compute": {
            "dense_tensor_flop": 713031680,
            "removed_vs_n0_flop": 25165824,
            "status": "EXACT_SCHEDULED_TILE_WORK"
          }
        },
        {
          "allocation": {
            "block": 512,
            "grid": 64,
            "hard_gate": "no spill and no resource-cap regression",
            "unchanged_from_n0": true
          },
          "bytes_by_boundary": {
            "global_bytes_change_vs_n0": 0,
            "logical_request_bytes": 23134592,
            "physical_transactions": "UNKNOWN_NOT_NEEDED_FOR_STATIC_ADMISSION"
          },
          "correctness": {
            "semantic_boundaries": [
              "BF16_score",
              "BF16_raw_o",
              "independent_gated_RMS_post"
            ],
            "status": "PENDING"
          },
          "decision": "CONDITIONAL_CANDIDATE",
          "device_coverage": {
            "one_wave_grid_fraction": 0.3764705882352941,
            "sm_count": 170,
            "status": "GEOMETRIC_BOUND_NOT_UTILIZATION"
          },
          "measured_us": {
            "median": null,
            "status": "NOT_MEASURED",
            "unit": "us"
          },
          "padded_compute": {
            "dense_tensor_flop": 182976512,
            "status": "EXPLICIT_16x16_TILE_GRANULARITY"
          },
          "predicted_dag_us": {
            "lower": 0.0,
            "note": "decision window only; not a silicon performance bound",
            "status": "UNRANKED_NO_LATENCY_BENEFIT_ASSUMED",
            "unit": "us",
            "upper": 34.57899997889996
          },
          "schedule_id": "N2",
          "synchronization": {
            "candidate_extra_barriers": 0,
            "cross_kernel_edges": [
              "s01_to_s2",
              "s2_to_s3",
              "s3_to_post"
            ],
            "kernel_count": 4
          },
          "uncertainty": {
            "reason": "scheduled FLOP removal does not determine latency under issue/control/resource coupling",
            "status": "LAYOUT_VIEW_FEASIBLE_PENDING_IMPLEMENTATION"
          },
          "valid_compute": {
            "dense_tensor_flop": 687865856,
            "removed_vs_n0_flop": 50331648,
            "status": "LAYOUT_VIEW_FEASIBLE_PENDING_IMPLEMENTATION"
          }
        }
      ],
      "case_id": "s256",
      "current_schedule": {
        "allocation": {
          "block": 512,
          "grid": 64,
          "hard_gate": "no spill and no resource-cap regression",
          "unchanged_from_n0": false
        },
        "bytes_by_boundary": {
          "global_bytes_change_vs_n0": 0,
          "logical_request_bytes": 23134592,
          "physical_transactions": "UNKNOWN_NOT_NEEDED_FOR_STATIC_ADMISSION"
        },
        "correctness": {
          "semantic_boundaries": [
            "BF16_score",
            "BF16_raw_o",
            "independent_gated_RMS_post"
          ],
          "status": "PASS"
        },
        "decision": "BASELINE",
        "device_coverage": {
          "one_wave_grid_fraction": 0.3764705882352941,
          "sm_count": 170,
          "status": "GEOMETRIC_BOUND_NOT_UTILIZATION"
        },
        "measured_us": {
          "median": 26.667999103665352,
          "status": "MEASURED",
          "unit": "us"
        },
        "padded_compute": {
          "dense_tensor_flop": 233308160,
          "status": "EXPLICIT_16x16_TILE_GRANULARITY"
        },
        "predicted_dag_us": {
          "lower": 26.623999699950218,
          "status": "MEASURED",
          "unit": "us",
          "upper": 26.706499978899956
        },
        "schedule_id": "N0",
        "synchronization": {
          "candidate_extra_barriers": 0,
          "cross_kernel_edges": [
            "s01_to_s2",
            "s2_to_s3",
            "s3_to_post"
          ],
          "kernel_count": 4
        },
        "uncertainty": {
          "reason": "immutable production baseline",
          "status": "MEASURED"
        },
        "valid_compute": {
          "dense_tensor_flop": 738197504,
          "removed_vs_n0_flop": 0,
          "status": "EXACT_SCHEDULED_TILE_WORK"
        }
      },
      "legal_minimum": {
        "dense_tensor_flop": 504889344,
        "note": "mathematical minimum, realizable tile work and measured latency are distinct quantities",
        "tile_feasible_n1_flop": 713031680,
        "tile_feasible_n2_flop_if_static_gate_passes": 687865856
      },
      "pareto_frontier": [
        "N0",
        "N1",
        "N2_CONDITIONAL_ON_STATIC_GATE"
      ]
    },
    {
      "candidates": [
        {
          "allocation": {
            "block": 512,
            "grid": 96,
            "hard_gate": "no spill and no resource-cap regression",
            "unchanged_from_n0": true
          },
          "bytes_by_boundary": {
            "global_bytes_change_vs_n0": 0,
            "logical_request_bytes": 34701696,
            "physical_transactions": "UNKNOWN_NOT_NEEDED_FOR_STATIC_ADMISSION"
          },
          "correctness": {
            "semantic_boundaries": [
              "BF16_score",
              "BF16_raw_o",
              "independent_gated_RMS_post"
            ],
            "status": "PENDING"
          },
          "decision": "CONDITIONAL_CANDIDATE",
          "device_coverage": {
            "one_wave_grid_fraction": 0.5647058823529412,
            "sm_count": 170,
            "status": "GEOMETRIC_BOUND_NOT_UTILIZATION"
          },
          "measured_us": {
            "median": null,
            "status": "NOT_MEASURED",
            "unit": "us"
          },
          "padded_compute": {
            "dense_tensor_flop": 278659072,
            "status": "EXPLICIT_16x16_TILE_GRANULARITY"
          },
          "predicted_dag_us": {
            "lower": 0.0,
            "note": "decision window only; not a silicon performance bound",
            "status": "UNRANKED_NO_LATENCY_BENEFIT_ASSUMED",
            "unit": "us",
            "upper": 36.84100005030632
          },
          "schedule_id": "N1",
          "synchronization": {
            "candidate_extra_barriers": 0,
            "cross_kernel_edges": [
              "s01_to_s2",
              "s2_to_s3",
              "s3_to_post"
            ],
            "kernel_count": 4
          },
          "uncertainty": {
            "reason": "scheduled FLOP removal does not determine latency under issue/control/resource coupling",
            "status": "PRODUCTION_AB_REQUIRED"
          },
          "valid_compute": {
            "dense_tensor_flop": 1069547520,
            "removed_vs_n0_flop": 37748736,
            "status": "EXACT_SCHEDULED_TILE_WORK"
          }
        },
        {
          "allocation": {
            "block": 512,
            "grid": 96,
            "hard_gate": "no spill and no resource-cap regression",
            "unchanged_from_n0": true
          },
          "bytes_by_boundary": {
            "global_bytes_change_vs_n0": 0,
            "logical_request_bytes": 34701696,
            "physical_transactions": "UNKNOWN_NOT_NEEDED_FOR_STATIC_ADMISSION"
          },
          "correctness": {
            "semantic_boundaries": [
              "BF16_score",
              "BF16_raw_o",
              "independent_gated_RMS_post"
            ],
            "status": "PENDING"
          },
          "decision": "CONDITIONAL_CANDIDATE",
          "device_coverage": {
            "one_wave_grid_fraction": 0.5647058823529412,
            "sm_count": 170,
            "status": "GEOMETRIC_BOUND_NOT_UTILIZATION"
          },
          "measured_us": {
            "median": null,
            "status": "NOT_MEASURED",
            "unit": "us"
          },
          "padded_compute": {
            "dense_tensor_flop": 240910336,
            "status": "EXPLICIT_16x16_TILE_GRANULARITY"
          },
          "predicted_dag_us": {
            "lower": 0.0,
            "note": "decision window only; not a silicon performance bound",
            "status": "UNRANKED_NO_LATENCY_BENEFIT_ASSUMED",